Last login: Mon Oct 26 14:02:02 on ttys000
 rsh@rsh  ~
 mysql -u study -p
Enter password: 
Welcome to the MariaDB monitor.  Commands end with ; or \g.
Your MariaDB connection id is 3
Server version: 10.5.6-MariaDB Homebrew

Copyright (c) 2000, 2018, Oracle, MariaDB Corporation Ab and others.

Type 'help;' or '\h' for help. Type '\c' to clear the current input statement.

MariaDB [(none)]> show databases;
+--------------------+
| Database           |
+--------------------+
| information_schema |
| studydb            |
+--------------------+
2 rows in set (0.005 sec)

MariaDB [(none)]> use studydb
Reading table information for completion of table and column names
You can turn off this feature to get a quicker startup with -A

Database changed
MariaDB [studydb]> show tables;
+-------------------+
| Tables_in_studydb |
+-------------------+
| test1             |
+-------------------+
1 row in set (0.000 sec)

MariaDB [studydb]> drop table test1;
Query OK, 0 rows affected (0.009 sec)

MariaDB [studydb]> show tables;
Empty set (0.000 sec)

MariaDB [studydb]> create table test1(
    ->   no int primary key,
    ->   name varchar(20),
    ->   age int,
    ->   kor int,
    ->   eng int,
    ->   math int,
    ->   constraint test1_uk unique (name, age),
    ->   fulltext index test1_name_idx (name)
    -> );
Query OK, 0 rows affected (0.033 sec)

MariaDB [studydb]> insert into test1(no,name,age,kor,eng,math) values(1,'aaa',20,80,80,80);
Query OK, 1 row affected (0.004 sec)

MariaDB [studydb]> insert into test1(no,name,age,kor,eng,math) values(2,'bbb',21,90,80,80);
Query OK, 1 row affected (0.001 sec)

MariaDB [studydb]> insert into test1(no,name,age,kor,eng,math) values(3,'ccc',20,80,80,80);
Query OK, 1 row affected (0.000 sec)

MariaDB [studydb]> insert into test1(no,name,age,kor,eng,math) values(4,'ddd',22,90,80,80);
Query OK, 1 row affected (0.000 sec)

MariaDB [studydb]> insert into test1(no,name,age,kor,eng,math) values(5,'eee',20,80,80,80); 
Query OK, 1 row affected (0.001 sec)

MariaDB [studydb]> select * from test1;
+----+------+------+------+------+------+
| no | name | age  | kor  | eng  | math |
+----+------+------+------+------+------+
|  1 | aaa  |   20 |   80 |   80 |   80 |
|  2 | bbb  |   21 |   90 |   80 |   80 |
|  3 | ccc  |   20 |   80 |   80 |   80 |
|  4 | ddd  |   22 |   90 |   80 |   80 |
|  5 | eee  |   20 |   80 |   80 |   80 |
+----+------+------+------+------+------+
5 rows in set (0.002 sec)

MariaDB [studydb]> select * from test1 where name = 'ccc';
+----+------+------+------+------+------+
| no | name | age  | kor  | eng  | math |
+----+------+------+------+------+------+
|  3 | ccc  |   20 |   80 |   80 |   80 |
+----+------+------+------+------+------+
1 row in set (0.006 sec)

MariaDB [studydb]> drop table test1;
Query OK, 0 rows affected (0.016 sec)

MariaDB [studydb]> create table test1 (
    ->   name varchar(3),
    ->   kor int,
    ->   eng int,
    ->   math int,
    ->   sum int,
    ->   aver int
    -> );
Query OK, 0 rows affected (0.012 sec)

MariaDB [studydb]> desc test1;
+-------+------------+------+-----+---------+-------+
| Field | Type       | Null | Key | Default | Extra |
+-------+------------+------+-----+---------+-------+
| name  | varchar(3) | YES  |     | NULL    |       |
| kor   | int(11)    | YES  |     | NULL    |       |
| eng   | int(11)    | YES  |     | NULL    |       |
| math  | int(11)    | YES  |     | NULL    |       |
| sum   | int(11)    | YES  |     | NULL    |       |
| aver  | int(11)    | YES  |     | NULL    |       |
+-------+------------+------+-----+---------+-------+
6 rows in set (0.006 sec)

MariaDB [studydb]> alter table test1
    ->   add column no int;
Query OK, 0 rows affected (0.021 sec)
Records: 0  Duplicates: 0  Warnings: 0

MariaDB [studydb]> desc test1;
+-------+------------+------+-----+---------+-------+
| Field | Type       | Null | Key | Default | Extra |
+-------+------------+------+-----+---------+-------+
| name  | varchar(3) | YES  |     | NULL    |       |
| kor   | int(11)    | YES  |     | NULL    |       |
| eng   | int(11)    | YES  |     | NULL    |       |
| math  | int(11)    | YES  |     | NULL    |       |
| sum   | int(11)    | YES  |     | NULL    |       |
| aver  | int(11)    | YES  |     | NULL    |       |
| no    | int(11)    | YES  |     | NULL    |       |
+-------+------------+------+-----+---------+-------+
7 rows in set (0.003 sec)

MariaDB [studydb]> alter table test1
    ->   add column age int; 
Query OK, 0 rows affected (0.020 sec)
Records: 0  Duplicates: 0  Warnings: 0

MariaDB [studydb]> desc test1;
+-------+------------+------+-----+---------+-------+
| Field | Type       | Null | Key | Default | Extra |
+-------+------------+------+-----+---------+-------+
| name  | varchar(3) | YES  |     | NULL    |       |
| kor   | int(11)    | YES  |     | NULL    |       |
| eng   | int(11)    | YES  |     | NULL    |       |
| math  | int(11)    | YES  |     | NULL    |       |
| sum   | int(11)    | YES  |     | NULL    |       |
| aver  | int(11)    | YES  |     | NULL    |       |
| no    | int(11)    | YES  |     | NULL    |       |
| age   | int(11)    | YES  |     | NULL    |       |
+-------+------------+------+-----+---------+-------+
8 rows in set (0.004 sec)

MariaDB [studydb]> alter table test1
    ->   add column no2 int,
    ->   add column age2 int;  
Query OK, 0 rows affected (0.014 sec)
Records: 0  Duplicates: 0  Warnings: 0

MariaDB [studydb]> desc test1;
+-------+------------+------+-----+---------+-------+
| Field | Type       | Null | Key | Default | Extra |
+-------+------------+------+-----+---------+-------+
| name  | varchar(3) | YES  |     | NULL    |       |
| kor   | int(11)    | YES  |     | NULL    |       |
| eng   | int(11)    | YES  |     | NULL    |       |
| math  | int(11)    | YES  |     | NULL    |       |
| sum   | int(11)    | YES  |     | NULL    |       |
| aver  | int(11)    | YES  |     | NULL    |       |
| no    | int(11)    | YES  |     | NULL    |       |
| age   | int(11)    | YES  |     | NULL    |       |
| no2   | int(11)    | YES  |     | NULL    |       |
| age2  | int(11)    | YES  |     | NULL    |       |
+-------+------------+------+-----+---------+-------+
10 rows in set (0.003 sec)

MariaDB [studydb]> alter table test1
    ->   add constraint test1_pk primary key (no),
    ->   add constraint test1_uk unique (name, age),
    ->   add fulltext index test1_name_idx (name);
Query OK, 0 rows affected, 1 warning (0.041 sec)
Records: 0  Duplicates: 0  Warnings: 1

MariaDB [studydb]> desc test1;
+-------+------------+------+-----+---------+-------+
| Field | Type       | Null | Key | Default | Extra |
+-------+------------+------+-----+---------+-------+
| name  | varchar(3) | YES  | MUL | NULL    |       |
| kor   | int(11)    | YES  |     | NULL    |       |
| eng   | int(11)    | YES  |     | NULL    |       |
| math  | int(11)    | YES  |     | NULL    |       |
| sum   | int(11)    | YES  |     | NULL    |       |
| aver  | int(11)    | YES  |     | NULL    |       |
| no    | int(11)    | NO   | PRI | NULL    |       |
| age   | int(11)    | YES  |     | NULL    |       |
| no2   | int(11)    | YES  |     | NULL    |       |
| age2  | int(11)    | YES  |     | NULL    |       |
+-------+------------+------+-----+---------+-------+
10 rows in set (0.004 sec)

MariaDB [studydb]> alter table test1
    ->   modify column name varchar(20) not null,
    ->   modify column age int not null,
    ->   modify column kor int not null,
    ->   modify column eng int not null,
    ->   modify column math int not null,
    ->   modify column sum int not null,
    ->   modify column aver float not null;
Query OK, 0 rows affected (0.051 sec)              
Records: 0  Duplicates: 0  Warnings: 0

MariaDB [studydb]> desc test1;
+-------+-------------+------+-----+---------+-------+
| Field | Type        | Null | Key | Default | Extra |
+-------+-------------+------+-----+---------+-------+
| name  | varchar(20) | NO   | MUL | NULL    |       |
| kor   | int(11)     | NO   |     | NULL    |       |
| eng   | int(11)     | NO   |     | NULL    |       |
| math  | int(11)     | NO   |     | NULL    |       |
| sum   | int(11)     | NO   |     | NULL    |       |
| aver  | float       | NO   |     | NULL    |       |
| no    | int(11)     | NO   | PRI | NULL    |       |
| age   | int(11)     | NO   |     | NULL    |       |
| no2   | int(11)     | YES  |     | NULL    |       |
| age2  | int(11)     | YES  |     | NULL    |       |
+-------+-------------+------+-----+---------+-------+
10 rows in set (0.003 sec)

MariaDB [studydb]> insert into test1(no,name,age,kor,eng,math,sum,aver)
    ->   values(1,'aaa',20,100,100,100,300,100);
Query OK, 1 row affected (0.002 sec)

MariaDB [studydb]> insert into test1(no,name,age,kor,eng,math,sum,aver)
    ->   values(2,'bbb',21,100,100,100,300,100);
Query OK, 1 row affected (0.001 sec)

MariaDB [studydb]> desc test1;
+-------+-------------+------+-----+---------+-------+
| Field | Type        | Null | Key | Default | Extra |
+-------+-------------+------+-----+---------+-------+
| name  | varchar(20) | NO   | MUL | NULL    |       |
| kor   | int(11)     | NO   |     | NULL    |       |
| eng   | int(11)     | NO   |     | NULL    |       |
| math  | int(11)     | NO   |     | NULL    |       |
| sum   | int(11)     | NO   |     | NULL    |       |
| aver  | float       | NO   |     | NULL    |       |
| no    | int(11)     | NO   | PRI | NULL    |       |
| age   | int(11)     | NO   |     | NULL    |       |
| no2   | int(11)     | YES  |     | NULL    |       |
| age2  | int(11)     | YES  |     | NULL    |       |
+-------+-------------+------+-----+---------+-------+
10 rows in set (0.003 sec)

MariaDB [studydb]> select * from test1;
+------+-----+-----+------+-----+------+----+-----+------+------+
| name | kor | eng | math | sum | aver | no | age | no2  | age2 |
+------+-----+-----+------+-----+------+----+-----+------+------+
| aaa  | 100 | 100 |  100 | 300 |  100 |  1 |  20 | NULL | NULL |
| bbb  | 100 | 100 |  100 | 300 |  100 |  2 |  21 | NULL | NULL |
+------+-----+-----+------+-----+------+----+-----+------+------+
2 rows in set (0.001 sec)

MariaDB [studydb]> insert into test1(no,name,age,kor,eng,math,sum,aver)
    ->   values(3,'bbb',21,100,100,100,300,100); 
ERROR 1062 (23000): Duplicate entry 'bbb-21' for key 'test1_uk'
MariaDB [studydb]> drop table test1;
Query OK, 0 rows affected (0.010 sec)

MariaDB [studydb]> create table test1(
    ->   no int not null,
    ->   name varchar(20) not null
    -> );
Query OK, 0 rows affected (0.016 sec)

MariaDB [studydb]> alter table test1
    ->   modify column no int not null auto_increment;
ERROR 1075 (42000): Incorrect table definition; there can be only one auto column and it must be defined as a key
MariaDB [studydb]> alter table test1
    ->   add constraint primary key (no); /* 일단 no를 pk로 지정한다.*/
Query OK, 0 rows affected (0.016 sec)
Records: 0  Duplicates: 0  Warnings: 0

MariaDB [studydb]> alter table test1
    -> 
    -> ;
Query OK, 0 rows affected (0.001 sec)
Records: 0  Duplicates: 0  Warnings: 0

MariaDB [studydb]> alter table test1
    ->   modify column no int not null auto_increment;
Query OK, 0 rows affected (0.034 sec)              
Records: 0  Duplicates: 0  Warnings: 0

MariaDB [studydb]> desc test1;
+-------+-------------+------+-----+---------+----------------+
| Field | Type        | Null | Key | Default | Extra          |
+-------+-------------+------+-----+---------+----------------+
| no    | int(11)     | NO   | PRI | NULL    | auto_increment |
| name  | varchar(20) | NO   |     | NULL    |                |
+-------+-------------+------+-----+---------+----------------+
2 rows in set (0.005 sec)

MariaDB [studydb]> insert into test1(no, name) values(1, 'xxx');
Query OK, 1 row affected (0.001 sec)

MariaDB [studydb]> select * from test1;
+----+------+
| no | name |
+----+------+
|  1 | xxx  |
+----+------+
1 row in set (0.000 sec)

MariaDB [studydb]> insert into test1(name) values('aaa');
Query OK, 1 row affected (0.001 sec)

MariaDB [studydb]> select * from test1;
+----+------+
| no | name |
+----+------+
|  1 | xxx  |
|  2 | aaa  |
+----+------+
2 rows in set (0.000 sec)

MariaDB [studydb]> insert into test1(no, name) values(100, 'yyy');
Query OK, 1 row affected (0.001 sec)

MariaDB [studydb]> select * from test1;
+-----+------+
| no  | name |
+-----+------+
|   1 | xxx  |
|   2 | aaa  |
| 100 | yyy  |
+-----+------+
3 rows in set (0.000 sec)

MariaDB [studydb]> insert into test1(name) values('bbb');
Query OK, 1 row affected (0.001 sec)

MariaDB [studydb]> select * from test1;
+-----+------+
| no  | name |
+-----+------+
|   1 | xxx  |
|   2 | aaa  |
| 100 | yyy  |
| 101 | bbb  |
+-----+------+
4 rows in set (0.000 sec)

MariaDB [studydb]> insert into test1(name) values('ccc');
Query OK, 1 row affected (0.001 sec)

MariaDB [studydb]> insert into test1(name) values('ddd');
Query OK, 1 row affected (0.001 sec)

MariaDB [studydb]> select * from test1;
+-----+------+
| no  | name |
+-----+------+
|   1 | xxx  |
|   2 | aaa  |
| 100 | yyy  |
| 101 | bbb  |
| 102 | ccc  |
| 103 | ddd  |
+-----+------+
6 rows in set (0.000 sec)

MariaDB [studydb]> delete from test1 where no=103;
Query OK, 1 row affected (0.003 sec)

MariaDB [studydb]> insert into test1(name) values('eee');
Query OK, 1 row affected (0.001 sec)

MariaDB [studydb]> select * from test1;
+-----+------+
| no  | name |
+-----+------+
|   1 | xxx  |
|   2 | aaa  |
| 100 | yyy  |
| 101 | bbb  |
| 102 | ccc  |
| 104 | eee  |
+-----+------+
6 rows in set (0.000 sec)

MariaDB [studydb]> insert into test1(name) values('fff');
Query OK, 1 row affected (0.002 sec)

MariaDB [studydb]> select * from test1;
+-----+------+
| no  | name |
+-----+------+
|   1 | xxx  |
|   2 | aaa  |
| 100 | yyy  |
| 101 | bbb  |
| 102 | ccc  |
| 104 | eee  |
| 105 | fff  |
+-----+------+
7 rows in set (0.000 sec)

MariaDB [studydb]> 
MariaDB [studydb]> insert into test1(name) values('123456789012345678901234');
ERROR 1406 (22001): Data too long for column 'name' at row 1
MariaDB [studydb]> insert into test1(name) values('ggg');
Query OK, 1 row affected (0.001 sec)

MariaDB [studydb]> select * from test1;
+-----+------+
| no  | name |
+-----+------+
|   1 | xxx  |
|   2 | aaa  |
| 100 | yyy  |
| 101 | bbb  |
| 102 | ccc  |
| 104 | eee  |
| 105 | fff  |
| 106 | ggg  |
+-----+------+
8 rows in set (0.000 sec)

MariaDB [studydb]> drop table test1;
Query OK, 0 rows affected (0.004 sec)

MariaDB [studydb]> create table test1 (
    ->   no int primary key auto_increment,
    ->   name varchar(20) not null,
    ->   class varchar(10) not null,
    ->   working char(1) not null,
    ->   tel varchar(20)
    -> );
Query OK, 0 rows affected (0.017 sec)

MariaDB [studydb]> insert into test1(name,class,working) values('aaa','java100','Y');
Query OK, 1 row affected (0.002 sec)

MariaDB [studydb]> insert into test1(name,class,working) values('bbb','java100','N');
Query OK, 1 row affected (0.000 sec)

MariaDB [studydb]> insert into test1(name,class,working) values('ccc','java100','Y');
Query OK, 1 row affected (0.000 sec)

MariaDB [studydb]> insert into test1(name,class,working) values('ddd','java100','N');
Query OK, 1 row affected (0.000 sec)

MariaDB [studydb]> insert into test1(name,class,working) values('eee','java100','Y');
Query OK, 1 row affected (0.000 sec)

MariaDB [studydb]> insert into test1(name,class,working) values('kkk','java101','N');
Query OK, 1 row affected (0.000 sec)

MariaDB [studydb]> insert into test1(name,class,working) values('lll','java101','Y');
Query OK, 1 row affected (0.001 sec)

MariaDB [studydb]> insert into test1(name,class,working) values('mmm','java101','N');
Query OK, 1 row affected (0.002 sec)

MariaDB [studydb]> insert into test1(name,class,working) values('nnn','java101','Y');
Query OK, 1 row affected (0.000 sec)

MariaDB [studydb]> insert into test1(name,class,working) values('ooo','java101','N'); 
Query OK, 1 row affected (0.001 sec)

MariaDB [studydb]> select * from test1;
+----+------+---------+---------+------+
| no | name | class   | working | tel  |
+----+------+---------+---------+------+
|  1 | aaa  | java100 | Y       | NULL |
|  2 | bbb  | java100 | N       | NULL |
|  3 | ccc  | java100 | Y       | NULL |
|  4 | ddd  | java100 | N       | NULL |
|  5 | eee  | java100 | Y       | NULL |
|  6 | kkk  | java101 | N       | NULL |
|  7 | lll  | java101 | Y       | NULL |
|  8 | mmm  | java101 | N       | NULL |
|  9 | nnn  | java101 | Y       | NULL |
| 10 | ooo  | java101 | N       | NULL |
+----+------+---------+---------+------+
10 rows in set (0.000 sec)

MariaDB [studydb]> select no, name, class from test1 where working = 'Y';
+----+------+---------+
| no | name | class   |
+----+------+---------+
|  1 | aaa  | java100 |
|  3 | ccc  | java100 |
|  5 | eee  | java100 |
|  7 | lll  | java101 |
|  9 | nnn  | java101 |
+----+------+---------+
5 rows in set (0.000 sec)

MariaDB [studydb]> select no, name, class from test1 where working = 'N';
+----+------+---------+
| no | name | class   |
+----+------+---------+
|  2 | bbb  | java100 |
|  4 | ddd  | java100 |
|  6 | kkk  | java101 |
|  8 | mmm  | java101 |
| 10 | ooo  | java101 |
+----+------+---------+
5 rows in set (0.000 sec)

MariaDB [studydb]> create view worker
    ->   as select no, name, class from test1 where working = 'Y';
Query OK, 0 rows affected (0.015 sec)

MariaDB [studydb]> show tables;
+-------------------+
| Tables_in_studydb |
+-------------------+
| test1             |
| worker            |
+-------------------+
2 rows in set (0.000 sec)

MariaDB [studydb]> select * from worker;
+----+------+---------+
| no | name | class   |
+----+------+---------+
|  1 | aaa  | java100 |
|  3 | ccc  | java100 |
|  5 | eee  | java100 |
|  7 | lll  | java101 |
|  9 | nnn  | java101 |
+----+------+---------+
5 rows in set (0.003 sec)

MariaDB [studydb]> insert into test1(name,class,working) values('ppp','java101','Y');
Query OK, 1 row affected (0.002 sec)

MariaDB [studydb]> select * from worker;
+----+------+---------+
| no | name | class   |
+----+------+---------+
|  1 | aaa  | java100 |
|  3 | ccc  | java100 |
|  5 | eee  | java100 |
|  7 | lll  | java101 |
|  9 | nnn  | java101 |
| 11 | ppp  | java101 |
+----+------+---------+
6 rows in set (0.000 sec)

MariaDB [studydb]> drop view worker;
Query OK, 0 rows affected (0.002 sec)

MariaDB [studydb]> show tables;
+-------------------+
| Tables_in_studydb |
+-------------------+
| test1             |
+-------------------+
1 row in set (0.000 sec)

MariaDB [studydb]> drop table test1;
Query OK, 0 rows affected (0.003 sec)

MariaDB [studydb]> show tables;
Empty set (0.000 sec)

MariaDB [studydb]> 
